listening on lo, link-type EN10MB (Ethernet), snapshot length 262144 bytes
05:51:28.613732 IP localhost.41392 > localhost.8000: Flags [S], seq 694995106, win 65495, options [mss 65495,sackOK,TS val 2655888393 ecr 0,nop,wscale 7], length 0
05:51:28.613747 IP localhost.8000 > localhost.41392: Flags [S.], seq 3415339448, ack 694995107, win 65483, options [mss 65495,sackOK,TS val 2655888393 ecr 2655888393,nop,wscale 7], length 0
05:51:28.613758 IP localhost.41392 > localhost.8000: Flags [.], ack 1, win 512, options [nop,nop,TS val 2655888393 ecr 2655888393], length 0
05:51:28.613791 IP localhost.41392 > localhost.8000: Flags [P.], seq 1:3, ack 1, win 512, options [nop,nop,TS val 2655888393 ecr 2655888393], length 2
05:51:28.613797 IP localhost.8000 > localhost.41392: Flags [.], ack 3, win 512, options [nop,nop,TS val 2655888393 ecr 2655888393], length 0
05:51:28.613821 IP localhost.8000 > localhost.41392: Flags [P.], seq 1:19, ack 3, win 512, options [nop,nop,TS val 2655888393 ecr 2655888393], length 18
05:51:28.613830 IP localhost.41392 > localhost.8000: Flags [.], ack 19, win 512, options [nop,nop,TS val 2655888393 ecr 2655888393], length 0
05:51:28.613839 IP localhost.8000 > localhost.41392: Flags [F.], seq 19, ack 3, win 512, options [nop,nop,TS val 2655888393 ecr 2655888393], length 0
05:51:28.613840 IP localhost.41392 > localhost.8000: Flags [F.], seq 3, ack 19, win 512, options [nop,nop,TS val 2655888393 ecr 2655888393], length 0
05:51:28.613843 IP localhost.8000 > localhost.41392: Flags [.], ack 4, win 512, options [nop,nop,TS val 2655888393 ecr 2655888393], length 0
05:51:28.613846 IP localhost.41392 > localhost.8000: Flags [.], ack 20, win 512, options [nop,nop,TS val 2655888393 ecr 2655888393], length 0

